{
  "$schema": "http://json-schema.org/draft-07/schema#",
  "$id": "tech9/vocab/role",
  "title": "Role Definition",
  "description": "Schema for a tech9 vocabulary role definition. Every file in vocab/roles/ must validate against this.",
  "type": "object",
  "required": [
    "id",
    "name",
    "category",
    "responsibility",
    "inputs",
    "outputs",
    "dependencies"
  ],
  "additionalProperties": false,
  "properties": {
    "id": {
      "type": "string",
      "pattern": "^[a-z][a-z0-9_]*$",
      "description": "Slug \u2014 used as the agent filename (e.g. 'dev' \u2192 agents/dev.md). Must be unique across the vocabulary."
    },
    "name": {
      "type": "string",
      "description": "Display name shown in GAME_PLAN.md (e.g. 'Dev', 'Art Director')."
    },
    "category": {
      "type": "string",
      "enum": [
        "creative",
        "engineering",
        "shipping",
        "meta"
      ],
      "description": "Which layer of the team this role belongs to. 'meta' roles (historian) act on the framework rather than on a game."
    },
    "responsibility": {
      "type": "string",
      "description": "One paragraph. What this role owns end-to-end. The Director reads this to decide whether to include the role."
    },
    "inputs": {
      "type": "array",
      "minItems": 1,
      "description": "Everything this role must read before it can do its work.",
      "items": {
        "type": "object",
        "required": [
          "source",
          "artifact",
          "required"
        ],
        "additionalProperties": false,
        "properties": {
          "source": {
            "type": "string",
            "pattern": "^(concept|game_plan|role:[a-z][a-z0-9_]*|external|game|repo|meta)$",
            "description": "concept | game_plan | role:<id> | external | game | repo | meta"
          },
          "artifact": {
            "type": "string",
            "description": "File path or document name (e.g. 'CONCEPT.md', 'agents/art.md output')."
          },
          "required": {
            "type": "boolean",
            "description": "If true, this role cannot start without this input."
          },
          "notes": {
            "type": "string",
            "description": "What specifically to look for in this artifact. Optional."
          }
        }
      }
    },
    "outputs": {
      "type": "array",
      "minItems": 1,
      "description": "Artifacts this role produces. Other roles' inputs reference these.",
      "items": {
        "type": "object",
        "required": [
          "artifact",
          "description"
        ],
        "additionalProperties": false,
        "properties": {
          "artifact": {
            "type": "string",
            "description": "File path or document name produced."
          },
          "description": {
            "type": "string",
            "description": "What this artifact contains and which roles consume it."
          }
        }
      }
    },
    "dependencies": {
      "type": "array",
      "description": "Role IDs that must have delivered outputs before this role starts. Used by Scaffolder for execution order.",
      "items": {
        "type": "string",
        "pattern": "^[a-z][a-z0-9_]*$"
      }
    },
    "merge": {
      "type": "object",
      "description": "Rules the Director uses when deciding whether to merge or split this role.",
      "additionalProperties": false,
      "properties": {
        "candidates": {
          "type": "array",
          "items": {
            "type": "string"
          },
          "description": "Role IDs commonly merged into this one for simple games."
        },
        "merge_when": {
          "type": "string",
          "description": "Condition under which merging this role is appropriate."
        },
        "split_when": {
          "type": "string",
          "description": "Condition under which this role warrants splitting into sub-roles."
        }
      }
    },
    "prompt_template": {
      "type": "string",
      "description": "Template for generating agents/<id>.md. Placeholders: {{game_name}}, {{concept_summary}}, {{phase_goal}}, {{inputs_list}}, {{outputs_list}}, {{hard_constraints}}."
    },
    "renderer_variants": {
      "type": "object",
      "description": "Web-tier-specific deps/dev-server/template, keyed by rendering_tier. Only meaningful on `dev`."
    },
    "graduation_model": {
      "type": "string",
      "description": "How a lesson owned by this role graduates into framework defaults. Only meaningful on `historian`."
    }
  }
}
